{
  "coordinate_frame": {
    "axes": "x_width_y_depth_z_up",
    "handedness": "right_handed",
    "origin": "shared_scene_global",
    "rotation_unit": "degree",
    "unit": "meter"
  },
  "geometry_conventions": {
    "inward_normal": "left_of_directed_wall_segment",
    "polygon_closure": "implicit_last_to_first",
    "polygon_winding": "counter_clockwise",
    "wall_segment_order": "matches_floor_polygon_edges"
  },
  "geometry_tolerance_m": 1e-06,
  "layout_id": "scene_011760",
  "room_count": 3,
  "room_order": [
    "room_000",
    "room_001",
    "room_002"
  ],
  "rooms": [
    {
      "floor_polygon_xy": [
        [
          -3.02618359375,
          -0.42801776123046875
        ],
        [
          -3.02618359375,
          -3.718017822265625
        ],
        [
          -1.0661834716796874,
          -3.718017822265625
        ],
        [
          -1.0661834716796874,
          -7.208017578125
        ],
        [
          6.08381640625,
          -7.208017578125
        ],
        [
          6.08381640625,
          -0.42801776123046875
        ]
      ],
      "floor_z_m": 0.0,
      "room_id": "room_000",
      "wall_segments": [
        {
          "end_xy": [
            -3.02618359375,
            -3.718017822265625
          ],
          "height_m": 3.3999586333045473,
          "inward_normal_xy": [
            1.0,
            0.0
          ],
          "start_xy": [
            -3.02618359375,
            -0.42801776123046875
          ],
          "thickness_m": 0.0,
          "wall_id": "room_000.wall_000"
        },
        {
          "end_xy": [
            -1.0661834716796874,
            -3.718017822265625
          ],
          "height_m": 3.3999586333045473,
          "inward_normal_xy": [
            0.0,
            1.0
          ],
          "start_xy": [
            -3.02618359375,
            -3.718017822265625
          ],
          "thickness_m": 0.0,
          "wall_id": "room_000.wall_001"
        },
        {
          "end_xy": [
            -1.0661834716796874,
            -7.208017578125
          ],
          "height_m": 3.3999586333045473,
          "inward_normal_xy": [
            1.0,
            0.0
          ],
          "start_xy": [
            -1.0661834716796874,
            -3.718017822265625
          ],
          "thickness_m": 0.0,
          "wall_id": "room_000.wall_002"
        },
        {
          "end_xy": [
            6.08381640625,
            -7.208017578125
          ],
          "height_m": 3.3999586333045473,
          "inward_normal_xy": [
            0.0,
            1.0
          ],
          "start_xy": [
            -1.0661834716796874,
            -7.208017578125
          ],
          "thickness_m": 0.0,
          "wall_id": "room_000.wall_003"
        },
        {
          "end_xy": [
            6.08381640625,
            -0.42801776123046875
          ],
          "height_m": 3.3999586333045473,
          "inward_normal_xy": [
            -1.0,
            0.0
          ],
          "start_xy": [
            6.08381640625,
            -7.208017578125
          ],
          "thickness_m": 0.0,
          "wall_id": "room_000.wall_004"
        },
        {
          "end_xy": [
            -3.02618359375,
            -0.42801776123046875
          ],
          "height_m": 3.3999586333045473,
          "inward_normal_xy": [
            0.0,
            -1.0
          ],
          "start_xy": [
            6.08381640625,
            -0.42801776123046875
          ],
          "thickness_m": 0.0,
          "wall_id": "room_000.wall_005"
        }
      ]
    },
    {
      "floor_polygon_xy": [
        [
          -4.70618359375,
          -10.688017578125
        ],
        [
          1.42381640625,
          -10.688017578125
        ],
        [
          1.42381640625,
          -7.448017578125
        ],
        [
          -4.70618359375,
          -7.448017578125
        ]
      ],
      "floor_z_m": 0.0,
      "room_id": "room_001",
      "wall_segments": [
        {
          "end_xy": [
            1.42381640625,
            -10.688017578125
          ],
          "height_m": 3.398479279790064,
          "inward_normal_xy": [
            0.0,
            1.0
          ],
          "start_xy": [
            -4.70618359375,
            -10.688017578125
          ],
          "thickness_m": 0.0,
          "wall_id": "room_001.wall_000"
        },
        {
          "end_xy": [
            1.42381640625,
            -7.448017578125
          ],
          "height_m": 3.398479279790064,
          "inward_normal_xy": [
            -1.0,
            0.0
          ],
          "start_xy": [
            1.42381640625,
            -10.688017578125
          ],
          "thickness_m": 0.0,
          "wall_id": "room_001.wall_001"
        },
        {
          "end_xy": [
            -4.70618359375,
            -7.448017578125
          ],
          "height_m": 3.398479279790064,
          "inward_normal_xy": [
            0.0,
            -1.0
          ],
          "start_xy": [
            1.42381640625,
            -7.448017578125
          ],
          "thickness_m": 0.0,
          "wall_id": "room_001.wall_002"
        },
        {
          "end_xy": [
            -4.70618359375,
            -10.688017578125
          ],
          "height_m": 3.398479279790064,
          "inward_normal_xy": [
            1.0,
            0.0
          ],
          "start_xy": [
            -4.70618359375,
            -7.448017578125
          ],
          "thickness_m": 0.0,
          "wall_id": "room_001.wall_003"
        }
      ]
    },
    {
      "floor_polygon_xy": [
        [
          -1.3061834716796874,
          -0.18801776123046876
        ],
        [
          -1.3061834716796874,
          3.041982177734375
        ],
        [
          -4.70618359375,
          3.041982177734375
        ],
        [
          -4.70618359375,
          -0.18801776123046876
        ]
      ],
      "floor_z_m": 0.0,
      "room_id": "room_002",
      "wall_segments": [
        {
          "end_xy": [
            -1.3061834716796874,
            3.041982177734375
          ],
          "height_m": 3.3999586333045473,
          "inward_normal_xy": [
            -1.0,
            0.0
          ],
          "start_xy": [
            -1.3061834716796874,
            -0.18801776123046876
          ],
          "thickness_m": 0.0,
          "wall_id": "room_002.wall_000"
        },
        {
          "end_xy": [
            -4.70618359375,
            3.041982177734375
          ],
          "height_m": 3.3999586333045473,
          "inward_normal_xy": [
            0.0,
            -1.0
          ],
          "start_xy": [
            -1.3061834716796874,
            3.041982177734375
          ],
          "thickness_m": 0.0,
          "wall_id": "room_002.wall_001"
        },
        {
          "end_xy": [
            -4.70618359375,
            -0.18801776123046876
          ],
          "height_m": 3.3999586333045473,
          "inward_normal_xy": [
            1.0,
            0.0
          ],
          "start_xy": [
            -4.70618359375,
            3.041982177734375
          ],
          "thickness_m": 0.0,
          "wall_id": "room_002.wall_002"
        },
        {
          "end_xy": [
            -1.3061834716796874,
            -0.18801776123046876
          ],
          "height_m": 3.3999586333045473,
          "inward_normal_xy": [
            0.0,
            1.0
          ],
          "start_xy": [
            -4.70618359375,
            -0.18801776123046876
          ],
          "thickness_m": 0.0,
          "wall_id": "room_002.wall_003"
        }
      ]
    }
  ],
  "schema_version": "non_rectangular_room_layout_v1"
}
